{
  "$schema": "http://json-schema.org/draft-07/schema#",
  "type": "object",
  "required": ["task_id", "decision", "destination"],
  "properties": {
    "task_id": {"type": "string"},
    "eval_report_id": {"type": "string"},
    "decision": {
      "type": "string",
      "enum": ["approve", "reject", "hold"]
    },
    "destination": {
      "type": "string",
      "enum": ["lti", "cos", "none"]
    },
    "post_action": {
      "type": "string",
      "enum": ["publish_now", "schedule", "do_not_publish", "hold"]
    },
    "canonical_decision": {
      "type": "string",
      "enum": ["merge_now", "create_now", "update_later", "no_change"]
    },
    "decision_reason": {"type": "string"},
    "decided_at": {"type": "string", "format": "date-time"}
  }
}
